R_REGIONKEY,R_NAME,R_COMMENT,edwLoadDate
0,AFRICA,lar deposits. blithely final packages cajole. regular waters are final requests. regular accounts are according to ,2026-01-01T00:00:00Z
1,AMERICA,"hs use ironic, even requests. s",2026-01-01T00:00:00Z
2,ASIA,ges. thinly even pinto beans ca,2026-01-01T00:00:00Z
3,EUROPE,ly final courts cajole furiously final excuse,2026-01-01T00:00:00Z
4,MIDDLE EAST,uickly special accounts cajole carefully blithely close requests. carefully final asymptotes haggle furiousl,2026-01-01T00:00:00Z
