S_SUPPKEY,S_NAME,S_ADDRESS,S_NATIONKEY,S_PHONE,S_ACCTBAL,S_COMMENT,edwLoadDate
9076,Supplier#000009076,"tPB3z0Il783Aok,",19,29-952-420-6082,990.16,"ual, bold dolphins. express dependencies above the regular, final courts haggle s",01-01-2026
9077,Supplier#000009077,TSKc 6qUKfGVMcGf,24,34-178-864-4858,7618.39,lar pinto beans haggle carefully carefully bold forges. ironic excuses wake carefully slyly regular ,01-01-2026
9078,Supplier#000009078,l4CvArLwcgpwaJ5oaX8uSr5KYA0lXn4v,19,29-495-229-3649,328.20,"s was after the quiet, final ideas. finally ironic dependencies haggle slyly. the",01-01-2026
9079,Supplier#000009079,"WJ0NpgRuusAnQR871,TSE4X",2,12-833-892-9506,3075.73, dazzle furiously about the ac,01-01-2026
9080,Supplier#000009080,"rGU D6cSBNcw8CW1zVEx4qZd6BmF,,R",14,24-739-807-5601,2790.48,"slyly regular accounts haggle blithely according to the express, silent requests. b",01-01-2026
9081,Supplier#000009081,d1tzc5gzpNRMgTjp1gZrl,9,19-894-687-5796,4627.52,elets. silent deposits cajole,01-01-2026
9082,Supplier#000009082,PBE1ryicleQTkevLvkfG,14,24-782-843-1885,2739.25,"s nag slyly above the daring, special accounts. carefully express instructions us",01-01-2026
9083,Supplier#000009083,wVIdyqHsk0UpdWUiW9YGz7HU8j,12,22-552-431-1228,1595.96,ly bold instructions. regular requests wake along the even accounts? requests,01-01-2026
9084,Supplier#000009084,vFZS4BU4E8BTJ5r8PcrZFtc2pnIXm,0,10-830-177-5803,3284.77,cial accounts. slyly final theodolites detect slyly fluffily regular reques,01-01-2026
9085,Supplier#000009085,3mbsprr7CRUTKfqiO3E,17,27-119-519-8096,7121.86, slyly unusual requests lose of the fo,01-01-2026
9086,Supplier#000009086,nU6wxt80ORwxECbKGo9pX,24,34-265-660-6775,4097.83,kly express accounts sleep. care,01-01-2026
9087,Supplier#000009087,R93KV7UdAptefzXjnqO9pfqgsV ZqpdHcC,23,33-722-513-3852,-722.12,oost evenly special theodolites. boldly even accounts integrate. furiously regular pinto be,01-01-2026
9088,Supplier#000009088,"w0QXNsQj44PdNP79s5KRcEuY6,leVVY",18,28-799-267-6993,5195.60,cross the quickly silent packages. ev,01-01-2026
9089,Supplier#000009089,IZerr6dMVc RxftltX2p,10,20-970-478-3730,2390.81,ts. evenly unusual requests nag carefully. instruc,01-01-2026
9090,Supplier#000009090,XC9q8e8jlbcAfi6CTFUwG6Q,19,29-294-757-5959,8254.50,"press, regular deposits. express deposits",01-01-2026
9091,Supplier#000009091,"lbaCDQ7 x3WK,kz9P0Mu0wUcpqg1gaAIUU",4,14-169-838-5652,-559.38,arefully even theodolites. carefully final asymptotes are slyly final ,01-01-2026
9092,Supplier#000009092,"xrTbMrl,fCoK",1,11-390-819-7605,1354.17,"ding to the unusual requests. bold, pending requests ",01-01-2026
9093,Supplier#000009093,zRcf1ht4TZLlvqRBs8sBr7aJAfawyX3yvG8mg Al,1,11-274-769-7251,9543.46,"e the ironic dolphins are furiously regular dependencies. slow, fluffy dolphins",01-01-2026
9094,Supplier#000009094,OdXhqpW7stmrXA4fMHv8Z MAXv,9,19-209-370-2359,4071.37,uickly ironic accounts are furiously slyly bold requests. careful,01-01-2026
9095,Supplier#000009095,"oDzJLjn,eiHwYxuaZhwDB0",23,33-694-615-5432,5589.90,y quickly unusual warthogs. always even theodo,01-01-2026
9096,Supplier#000009096,SsWOriAm1ybplhhyP,16,26-107-366-6452,7487.37,"ven, express foxes. pending, even pinto beans boost furiously furiously final idea",01-01-2026
3001,Supplier#000003001,"p,vtdzmZWY7YiO",24,34-171-876-8885,2399.74,latelets about the fluffily regular accounts us,01-01-2026
3002,Supplier#000003002,c0hweuB4hWi3gf0SA90AQjNmaglOQANz,23,33-348-775-8804,4366.90,"longside of the regular requests. bold, regular accounts print furi",01-01-2026
3003,Supplier#000003003,"8P71Pj89GiBowF,bvouOI vLK74vOCllIy1GYUJ1",4,14-926-417-9940,545.44, foxes. instructions x-ray ,01-01-2026
3004,Supplier#000003004,"O4nA6,ODeYqsE,ekbxsHM5vc",5,15-931-357-9763,2072.87,"ounts impress doggedly pending accounts. dogged, silen",01-01-2026
3005,Supplier#000003005,"7xWPGUbOUoeiPLNo,r",1,11-352-166-3995,-361.14,"s; unusual, bold dependencies affix q",01-01-2026
3006,Supplier#000003006,"y,NWe4l8cUbXgvwLDBpNnUmMxI5JODzUocB5",1,11-335-383-5953,227.50,deposits. unusual requests,01-01-2026
3007,Supplier#000003007,99oAgeU6C7zko3KhdUC,15,25-894-347-8240,4572.92,"ss requests wake furiously ironic, unusual depo",01-01-2026
3008,Supplier#000003008,"TSt8rc4Usc 1UdSD,6VwiuG2XS0tBzY",9,19-634-851-5012,9080.40,are. blithely dogged pinto beans about the carefully even pinto beans sleep furio,01-01-2026
